Taxon	feature	n	n_NA	n_neg	n_pos	imp_sum	imp_mean	imp_rank_sum	imp_rank_mean	imp_rank_min
"aac6-I, aacA7; aminoglycoside 6'-N-acetyltransferase I [EC:2.3.1.82]"	K18816	9	0	0	0	0	0	13911.5	1545.72222222222	1413.5
"aarC, cat1; succinyl-CoA:acetate CoA-transferase [EC:2.8.3.18]"	K18118	9	0	4	4	8.17610438343618e-05	9.0845604260402e-06	12797	1421.88888888889	364
"ABC-2.CYL.A, cylA; multidrug/hemolysin transport system ATP-binding protein"	K11050	9	0	3	4	9.44971307094508e-05	1.0499681189939e-05	13149	1461	36
"ABC-2.CYL.P, cylB; multidrug/hemolysin transport system permease protein"	K11051	9	0	3	3	1.40537220200899e-05	1.56152466889887e-06	13396	1488.44444444444	127
"ABC-2.OM, wza; polysaccharide biosynthesis/export protein"	K01991	9	0	2	6	0.000131396829224679	1.4599647691631e-05	10021.5	1113.5	440.5
"ABCB-BAC; ATP-binding cassette, subfamily B, bacterial"	K06147	9	0	2	4	7.08470402203976e-05	7.87189335782196e-06	11903	1322.55555555556	406
"ABCC-BAC; ATP-binding cassette, subfamily C, bacterial"	K06148	9	0	7	1	-0.000131838132226838	-1.46486813585375e-05	17928.5	1992.05555555556	394
"ABCF3; ATP-binding cassette, subfamily F, member 3"	K06158	9	0	0	0	0	0	13911.5	1545.72222222222	1413.5
"abnA; arabinan endo-1,5-alpha-L-arabinosidase [EC:3.2.1.99]"	K06113	9	0	5	4	-0.000115034926651594	-1.27816585168437e-05	15946	1771.77777777778	379
"ACADM, acd; acyl-CoA dehydrogenase [EC:1.3.8.7]"	K00249	9	0	1	8	0.000259042526693452	2.87825029659392e-05	7209	801	131
"ACADS, bcd; butyryl-CoA dehydrogenase [EC:1.3.8.1]"	K00248	9	0	4	5	6.5274982938961e-05	7.25277588210678e-06	11553.5	1283.72222222222	172
"accB, bccP; acetyl-CoA carboxylase biotin carboxyl carrier protein"	K02160	9	0	2	2	6.29941333551881e-05	6.99934815057646e-06	13024	1447.11111111111	381
"accC; acetyl-CoA carboxylase, biotin carboxylase subunit [EC:6.4.1.2 6.3.4.14]"	K01961	9	0	0	8	0.000652982448279257	7.25536053643619e-05	4720.5	524.5	72
"aceB, glcB; malate synthase [EC:2.3.3.9]"	K01638	9	0	2	5	7.18876727631911e-05	7.98751919591012e-06	11699	1299.88888888889	490
"ACO, acnA; aconitate hydratase [EC:4.2.1.3]"	K01681	9	0	1	7	0.000310999006871137	3.45554452079041e-05	8019.5	891.055555555556	134
"acpD, azoR; FMN-dependent NADH-azoreductase [EC:1.7.1.17]"	K01118	9	5	0	0	0	0	6315.5	1578.875	1530
"ACR3, arsB; arsenite transporter"	K03325	9	0	3	6	0.000100529497742321	1.11699441935913e-05	10995.5	1221.72222222222	219
"acrA, mexA, adeI, smeD, mtrC, cmeA; membrane fusion protein, multidrug efflux system"	K03585	9	6	0	0	0	0	4632.5	1544.16666666667	1421.5
"acrB, mexB, adeJ, smeE, mtrD, cmeB; multidrug efflux pump"	K18138	9	0	4	4	-8.12590187590188e-05	-9.0287798621132e-06	14522	1613.55555555556	715
"acrR; TetR/AcrR family transcriptional regulator, multidrug resistance operon repressor"	K18136	9	0	4	5	4.26932495078102e-05	4.74369438975669e-06	12381	1375.66666666667	48
"ACSL, fadD; long-chain acyl-CoA synthetase [EC:6.2.1.3]"	K01897	9	0	0	4	0.000546697682241601	6.07441869157335e-05	8865	985	31
"ACSS, acs; acetyl-CoA synthetase [EC:6.2.1.1]"	K01895	9	0	1	7	0.000379281675720505	4.21424084133895e-05	7471	830.111111111111	168
"ada-alkA; AraC family transcriptional regulator, regulatory protein of adaptative response / DNA-3-methyladenine glycosylase II [EC:3.2.2.21]"	K13529	9	0	5	4	-0.000105852376397946	-1.17613751553273e-05	14563	1618.11111111111	486
"ada; AraC family transcriptional regulator, regulatory protein of adaptative response / methylated-DNA-[protein]-cysteine methyltransferase [EC:2.1.1.63]"	K10778	9	0	0	0	0	0	13911.5	1545.72222222222	1413.5
"add, ADA; adenosine deaminase [EC:3.5.4.4]"	K01488	9	0	3	4	9.39640379550737e-05	1.04404486616749e-05	12766.5	1418.5	244
"adhP; alcohol dehydrogenase, propanol-preferring [EC:1.1.1.1]"	K13953	9	0	5	3	-0.000237887937174921	-2.64319930194356e-05	16329	1814.33333333333	130
"adk, AK; adenylate kinase [EC:2.7.4.3]"	K00939	9	0	3	2	-9.32027440194405e-06	-1.03558604466045e-06	14692.5	1632.5	925
"afuA, fbpA; iron(III) transport system substrate-binding protein"	K02012	9	0	2	4	7.23049972986861e-05	8.0338885887429e-06	12217.5	1357.5	231
"afuB, fbpB; iron(III) transport system permease protein"	K02011	9	0	3	3	5.70543631886306e-06	6.33937368762563e-07	13520	1502.22222222222	656
"afuC, fbpC; iron(III) transport system ATP-binding protein [EC:3.6.3.30]"	K02010	9	0	3	4	0.00040775499768806	4.53061108542289e-05	11174.5	1241.61111111111	21
"aglE, ggtB; alpha-glucoside transport system substrate-binding protein"	K10232	9	0	2	6	0.000373562654504922	4.1506961611658e-05	8758	973.111111111111	29
"AGPS, agpS; alkyldihydroxyacetonephosphate synthase [EC:2.5.1.26]"	K00803	9	0	0	0	0	0	13911.5	1545.72222222222	1413.5
"agrA, blpR, fsrA; two-component system, LytTR family, response regulator AgrA"	K07707	9	0	5	3	-2.92949463217857e-05	-3.25499403575397e-06	15244.5	1693.83333333333	264
"agrC, blpH, fsrC; two-component system, LytTR family, sensor histidine kinase AgrC [EC:2.7.13.3]"	K07706	9	0	3	5	-3.70037824380079e-05	-4.11153138200088e-06	12888	1432	507
"AIBP, nnrE; NAD(P)H-hydrate epimerase [EC:5.1.99.6]"	K17759	9	0	5	4	0.000110825028395304	1.23138920439226e-05	13654.5	1517.16666666667	207
"ALDO; fructose-bisphosphate aldolase, class I [EC:4.1.2.13]"	K01623	9	0	4	4	0.00031558881505023	3.506542389447e-05	12338	1370.88888888889	25
"algR; two-component system, LytTR family, response regulator AlgR"	K08083	9	0	3	5	1.91019453875241e-05	2.12243837639157e-06	12305	1367.22222222222	279
"algZ; two-component system, LytTR family, sensor histidine kinase AlgZ [EC:2.7.13.3]"	K08082	9	0	3	6	0.000191419478955999	2.1268830995111e-05	10654.5	1183.83333333333	192
"alsD, budA, aldC; acetolactate decarboxylase [EC:4.1.1.5]"	K01575	9	0	3	4	-1.7060470737725e-05	-1.89560785974722e-06	12823	1424.77777777778	479.5
"ampG; MFS transporter, PAT family, beta-lactamase induction signal transducer AmpG"	K08218	9	9	0	0	0	NA	0	NA	Inf
"amt, AMT, MEP; ammonium transporter, Amt family"	K03320	9	0	2	4	0.000149660000735325	1.66288889705917e-05	11735	1303.88888888889	137
"AMY, amyA, malS; alpha-amylase [EC:3.2.1.1]"	K01176	9	0	1	0	-1.53846153846154e-05	-1.70940170940171e-06	14399.5	1599.94444444444	1421.5
"apgM; 2,3-bisphosphoglycerate-independent phosphoglycerate mutase [EC:5.4.2.12]"	K15635	9	0	1	5	0.000108325812109841	1.20362013455379e-05	10504.5	1167.16666666667	346.5
"aprA; adenylylsulfate reductase, subunit A [EC:1.8.99.2]"	K00394	9	0	2	5	9.42151467647836e-05	1.04683496405315e-05	11615	1290.55555555556	385
"aprB; adenylylsulfate reductase, subunit B [EC:1.8.99.2]"	K00395	9	0	6	1	-0.000319139726341239	-3.5459969593471e-05	19304.5	2144.94444444444	1030
"APRT, apt; adenine phosphoribosyltransferase [EC:2.4.2.7]"	K00759	9	0	2	5	0.000337450271557382	3.74944746174869e-05	9266.5	1029.61111111111	98
"araM, egsA; glycerol-1-phosphate dehydrogenase [NAD(P)+] [EC:1.1.1.261]"	K00096	9	0	3	5	8.08775530928534e-05	8.98639478809482e-06	12124	1347.11111111111	159
"arcA; two-component system, OmpR family, aerobic respiration control protein ArcA"	K07773	9	0	3	5	-9.40499059691181e-05	-1.04499895521242e-05	13235.5	1470.61111111111	224
"arcB; two-component system, OmpR family, aerobic respiration control sensor histidine kinase ArcB [EC:2.7.13.3]"	K07648	9	0	3	6	-0.000179461810049623	-1.99402011166248e-05	12708.5	1412.05555555556	81
"argG, ASS1; argininosuccinate synthase [EC:6.3.4.5]"	K01940	9	0	5	3	7.31411877384956e-05	8.12679863761062e-06	14961.5	1662.38888888889	119
"argH, ASL; argininosuccinate lyase [EC:4.3.2.1]"	K01755	9	0	3	2	1.11830709784674e-05	1.24256344205193e-06	14117	1568.55555555556	474
"argR, ahrC; transcriptional regulator of arginine metabolism"	K03402	9	0	3	5	7.61631403549562e-05	8.46257115055069e-06	11948	1327.55555555556	311
"AROA1, aroA; chorismate mutase [EC:5.4.99.5]"	K04516	9	6	0	0	0	0	4632.5	1544.16666666667	1421.5
"AROA2, aroA; 3-deoxy-7-phosphoheptulonate synthase [EC:2.5.1.54]"	K03856	9	9	0	0	0	NA	0	NA	Inf
"aroQ, qutE; 3-dehydroquinate dehydratase II [EC:4.2.1.10]"	K03786	9	0	4	0	-8.39378504378505e-05	-9.32642782642784e-06	16757.5	1861.94444444444	1413.5
"arsA, ASNA1, GET3; arsenite/tail-anchored protein-transporting ATPase [EC:3.6.3.16 3.6.3.-]"	K01551	9	0	1	5	9.24315294702638e-05	1.02701699411404e-05	10774.5	1197.16666666667	573
"ARSC1, arsC; arsenate reductase [EC:1.20.4.1]"	K00537	9	0	2	6	0.000968194623184579	0.000107577180353842	7885.5	876.166666666667	2
"arsR; ArsR family transcriptional regulator, arsenate/arsenite/antimonite-responsive transcriptional repressor"	K03892	9	0	3	1	4.01528962938353e-07	4.46143292153725e-08	14639.5	1626.61111111111	314
"ascC, ddhC, rfbH; CDP-4-dehydro-6-deoxyglucose reductase, E1 [EC:1.17.1.1]"	K12452	9	0	1	6	0.00022509139835289	2.50101553725434e-05	9398.5	1044.27777777778	155
"ascD, ddhD, rfbI; CDP-4-dehydro-6-deoxyglucose reductase, E3 [EC:1.17.1.1]"	K00523	9	0	3	5	0.00013774512161186	1.53050135124289e-05	11338	1259.77777777778	284
"asnB, ASNS; asparagine synthase (glutamine-hydrolysing) [EC:6.3.5.4]"	K01953	9	0	5	3	8.3716286580891e-06	9.301809620099e-07	14350.5	1594.5	151
"asnC; Lrp/AsnC family transcriptional regulator, regulator for asnA, asnC and gidA"	K03718	9	3	0	0	0	0	9259.5	1543.25	1421.5
"aspC, aspS; nondiscriminating aspartyl-tRNA synthetase [EC:6.1.1.23]"	K09759	9	0	4	5	5.34825990209895e-06	5.94251100233217e-07	13565.5	1507.27777777778	136
"ATOX1, ATX1, copZ, golB; copper chaperone"	K07213	9	0	7	2	-0.0004144738752245	-4.60526528027222e-05	19429	2158.77777777778	380
"ATPeV1G, ATP6G; V-type H+-transporting ATPase subunit G"	K02152	9	1	1	0	-1.25e-05	-1.5625e-06	13032.5	1629.0625	1413.5
"ATPF0A, atpB; F-type H+-transporting ATPase subunit a"	K02108	9	0	1	7	0.000229392013559196	2.54880015065773e-05	8050.5	894.5	91
"ATPF0B, atpF; F-type H+-transporting ATPase subunit b"	K02109	9	0	2	6	0.000272178247283989	3.02420274759987e-05	8585.5	953.944444444444	157
"ATPF0C, atpE; F-type H+-transporting ATPase subunit c"	K02110	9	1	1	1	2.19089722537999e-05	2.73862153172499e-06	12041	1505.125	344.5
"ATPF1A, atpA; F-type H+-transporting ATPase subunit alpha [EC:3.6.3.14]"	K02111	9	1	3	2	-1.53885540982316e-05	-1.92356926227895e-06	13048.5	1631.0625	454.5
"ATPF1B, atpD; F-type H+-transporting ATPase subunit beta [EC:3.6.3.14]"	K02112	9	2	2	1	2.51190476190476e-05	3.58843537414966e-06	11015.5	1573.64285714286	352.5
"ATPF1D, atpH; F-type H+-transporting ATPase subunit delta"	K02113	9	0	4	2	-5.21465219994633e-05	-5.79405799994037e-06	15134.5	1681.61111111111	556
"ATPF1E, atpC; F-type H+-transporting ATPase subunit epsilon"	K02114	9	0	4	4	-3.22659719646225e-05	-3.58510799606917e-06	14506.5	1611.83333333333	562
"ATPF1G, atpG; F-type H+-transporting ATPase subunit gamma"	K02115	9	0	2	1	-2.84661246612466e-05	-3.16290274013851e-06	15149	1683.22222222222	1238
"ATPVA, ntpA, atpA; V/A-type H+/Na+-transporting ATPase subunit A [EC:3.6.3.14 3.6.3.15]"	K02117	9	0	1	3	8.88436205371689e-05	9.87151339301877e-06	11933	1325.88888888889	563
"ATPVB, ntpB, atpB; V/A-type H+/Na+-transporting ATPase subunit B"	K02118	9	0	4	2	-9.44394419936216e-05	-1.04932713326246e-05	15799.5	1755.5	528.5
"ATPVC, ntpC, atpC; V/A-type H+/Na+-transporting ATPase subunit C"	K02119	9	0	3	2	-2.4839457473757e-05	-2.75993971930634e-06	14337.5	1593.05555555556	721.5
"ATPVD, ntpD, atpD; V/A-type H+/Na+-transporting ATPase subunit D"	K02120	9	0	1	2	4.80895576044777e-05	5.3432841782753e-06	12953	1439.22222222222	449
"ATPVE, ntpE, atpE; V/A-type H+/Na+-transporting ATPase subunit E"	K02121	9	0	1	2	1.37037037037037e-05	1.52263374485597e-06	13529	1503.22222222222	597.5
"ATPVF, ntpF, atpF; V/A-type H+/Na+-transporting ATPase subunit F"	K02122	9	0	5	1	-0.00018506734006734	-2.056303778526e-05	17879.5	1986.61111111111	1096
"ATPVG, ahaH, atpH; V/A-type H+/Na+-transporting ATPase subunit G/H"	K02107	9	0	5	2	0.000366865561238236	4.07628401375817e-05	15449	1716.55555555556	1
"ATPVI, ntpI, atpI; V/A-type H+/Na+-transporting ATPase subunit I"	K02123	9	0	0	0	0	0	13911.5	1545.72222222222	1413.5
"ATPVK, ntpK, atpK; V/A-type H+/Na+-transporting ATPase subunit K"	K02124	9	0	1	4	5.82676453980803e-05	6.47418282200892e-06	11897.5	1321.94444444444	192
"AXY8, FUC95A, afcA; alpha-L-fucosidase 2 [EC:3.2.1.51]"	K15923	9	0	2	3	1.8869438059101e-06	2.096604228789e-07	13309	1478.77777777778	448
"bamE, smpA; outer membrane protein assembly factor BamE"	K06186	9	0	1	1	2.5225225225225e-06	2.80280280280278e-07	13741	1526.77777777778	971
"bccA, pccA; acetyl-CoA/propionyl-CoA carboxylase, biotin carboxylase, biotin carboxyl carrier protein [EC:6.4.1.2 6.4.1.3 6.3.4.14]"	K11263	9	0	2	4	0.000104635136148746	1.16261262387496e-05	11283	1253.66666666667	247
"BCP, PRXQ, DOT5; peroxiredoxin Q/BCP [EC:1.11.1.15]"	K03564	9	9	0	0	0	NA	0	NA	Inf
"bcr, tcaB; MFS transporter, DHA1 family, multidrug resistance protein"	K07552	9	0	4	3	9.97050304711475e-05	1.10783367190164e-05	13792.5	1532.5	104
"BDH, butB; (R,R)-butanediol dehydrogenase / meso-butanediol dehydrogenase / diacetyl reductase [EC:1.1.1.4 1.1.1.- 1.1.1.303]"	K00004	9	0	2	6	0.000257267462299491	2.85852735888324e-05	9304	1033.77777777778	92
"benK; MFS transporter, AAHS family, benzoate transport protein"	K05548	9	0	4	5	0.000167913378603093	1.86570420670103e-05	11990	1332.22222222222	261
"betB, gbsA; betaine-aldehyde dehydrogenase [EC:1.2.1.8]"	K00130	9	0	1	4	0.000158602725547697	1.76225250608552e-05	10116.5	1124.05555555556	285
"betT, betS; choline/glycine/proline betaine transport protein"	K02168	9	9	0	0	0	NA	0	NA	Inf
"bgaB, lacA; beta-galactosidase [EC:3.2.1.23]"	K12308	9	0	0	1	1.11111111111112e-05	1.23456790123457e-06	13445.5	1493.94444444444	1173
"birA; BirA family transcriptional regulator, biotin operon repressor / biotin---[acetyl-CoA-carboxylase] ligase [EC:6.3.4.15]"	K03524	9	0	2	1	-2.77701383583738e-05	-3.0855709287082e-06	14189	1576.55555555556	352.5
"BLMH, pepC; bleomycin hydrolase [EC:3.4.22.40]"	K01372	9	0	2	2	-9.89208328689614e-06	-1.09912036521068e-06	13604.5	1511.61111111111	469.5
"blt; MFS transporter, DHA1 family, multidrug resistance protein"	K08153	9	0	2	6	0.000211279541377209	2.34755045974676e-05	9287	1031.88888888889	282
"bluB; 5,6-dimethylbenzimidazole synthase [EC:1.13.11.79]"	K04719	9	4	0	0	0	0	7954.5	1590.9	1530
"bmpA, bmpB, tmpC; basic membrane protein A and related proteins"	K07335	9	0	3	2	-4.95674588569324e-05	-5.50749542854804e-06	14939.5	1659.94444444444	389
"bolA; BolA family transcriptional regulator, general stress-responsive regulator"	K05527	9	0	4	3	0.000100379602731265	1.11532891923628e-05	13528	1503.11111111111	250
"butA, budC; meso-butanediol dehydrogenase / (S,S)-butanediol dehydrogenase / diacetyl reductase [EC:1.1.1.- 1.1.1.76 1.1.1.304]"	K03366	9	0	0	2	0.000126005747126437	1.40006385696041e-05	11827.5	1314.16666666667	187
"capA, pgsA; gamma-polyglutamate biosynthesis protein CapA"	K07282	9	0	0	0	0	0	13911.5	1545.72222222222	1413.5
"carA, CPA1; carbamoyl-phosphate synthase small subunit [EC:6.3.5.5]"	K01956	9	0	2	2	2.78606530068299e-05	3.09562811186999e-06	13761	1529	123
"CARP, pepA; leucyl aminopeptidase [EC:3.4.11.1]"	K01255	9	8	0	0	0	0	1530	1530	1530
"CARS, cysS; cysteinyl-tRNA synthetase [EC:6.1.1.16]"	K01883	9	2	0	1	6.17760617760599e-07	8.82515168229427e-08	10542.5	1506.07142857143	1370
"casB, cse2; CRISPR system Cascade subunit CasB"	K19046	9	0	3	6	0.000347671993686742	3.86302215207491e-05	9037.5	1004.16666666667	100
"cat2, abfT; 4-hydroxybutyrate CoA-transferase [EC:2.8.3.-]"	K18122	9	0	4	5	0.000193267375122338	2.14741527913708e-05	12676.5	1408.5	24
"catE; catechol 2,3-dioxygenase [EC:1.13.11.2]"	K07104	9	0	1	2	1.05145145145145e-05	1.16827939050162e-06	13283	1475.88888888889	948.5
"cbe, mbe; cellobiose epimerase [EC:5.1.3.11]"	K16213	9	0	3	4	0.000102635378528089	1.14039309475655e-05	11815.5	1312.83333333333	234
"cbf, cbf1; 3'-5' exoribonuclease [EC:3.1.-.-]"	K03698	9	0	2	4	5.84431480351782e-05	6.4936831150198e-06	11552.5	1283.61111111111	152
"cbiB, cobD; adenosylcobinamide-phosphate synthase [EC:6.3.1.10]"	K02227	9	0	3	3	1.21715871715895e-06	1.35239857462106e-07	13526	1502.88888888889	640
"ccmG, dsbE; cytochrome c biogenesis protein CcmG, thiol:disulfide interchange protein DsbE"	K02199	9	0	3	5	-0.000172736412124535	-1.91929346805039e-05	13068.5	1452.05555555556	516
"cdd, CDA; cytidine deaminase [EC:3.5.4.5]"	K01489	9	0	2	2	0.000100819798974971	1.12021998861079e-05	12979.5	1442.16666666667	229
"cheA; two-component system, chemotaxis family, sensor kinase CheA [EC:2.7.13.3]"	K03407	9	0	4	3	-1.73374281279263e-05	-1.92638090310292e-06	14593	1621.44444444444	107
"cheB; two-component system, chemotaxis family, protein-glutamate methylesterase/glutaminase [EC:3.1.1.61 3.5.1.44]"	K03412	9	0	3	3	7.44863137729261e-05	8.27625708588068e-06	12893	1432.55555555556	278
"cheV; two-component system, chemotaxis family, chemotaxis protein CheV"	K03415	9	0	2	7	0.000339428125598671	3.77142361776301e-05	8423	935.888888888889	114
"cheY; two-component system, chemotaxis family, chemotaxis protein CheY"	K03413	9	0	4	5	0.00037668806175263	4.18542290836255e-05	12065.5	1340.61111111111	80
"chlD, bchD; magnesium chelatase subunit D [EC:6.6.1.1]"	K03404	9	0	3	5	0.000460030695821167	5.11145217579074e-05	10500.5	1166.72222222222	67
"chlI, bchI; magnesium chelatase subunit I [EC:6.6.1.1]"	K03405	9	0	2	7	0.000381194146633524	4.23549051815026e-05	7696.5	855.166666666667	94
"CHO1, pssA; CDP-diacylglycerol---serine O-phosphatidyltransferase [EC:2.7.8.8]"	K17103	9	0	0	1	1.6e-05	1.77777777777778e-06	13380.5	1486.72222222222	882.5
"ciaH; two-component system, OmpR family, sensor histidine kinase CiaH [EC:2.7.13.3]"	K14982	9	0	2	2	-4.54417701937167e-05	-5.04908557707964e-06	14505.5	1611.72222222222	981
"ciaR; two-component system, OmpR family, response regulator CiaR"	K14983	9	0	3	4	-2.38206058798545e-05	-2.6467339866505e-06	14148.5	1572.05555555556	655
"clpP, CLPP; ATP-dependent Clp protease, protease subunit [EC:3.4.21.92]"	K01358	9	0	1	3	8.93048128342255e-06	9.92275698158061e-07	12892.5	1432.5	857
"clpX, CLPX; ATP-dependent Clp protease ATP-binding subunit ClpX"	K03544	9	0	3	5	0.000118312471726058	1.31458301917842e-05	11338.5	1259.83333333333	419
"coaBC, dfp; phosphopantothenoylcysteine decarboxylase / phosphopantothenate---cysteine ligase [EC:4.1.1.36 6.3.2.5]"	K13038	9	0	4	5	-0.000207045143661609	-2.3005015962401e-05	14241	1582.33333333333	370
"cobA, btuR; cob(I)alamin adenosyltransferase [EC:2.5.1.17]"	K19221	9	0	3	3	5.6550156918018e-05	6.28335076866866e-06	13144.5	1460.5	403
"cobB-cbiA; cobyrinic acid a,c-diamide synthase [EC:6.3.5.9 6.3.5.11]"	K02224	9	0	2	4	8.40292762399053e-05	9.33658624887837e-06	11995	1332.77777777778	177
"cobC, phpB; alpha-ribazole phosphatase [EC:3.1.3.73]"	K02226	9	0	3	4	0.000272920186937646	3.0324465215294e-05	11988.5	1332.05555555556	107
"cobL; precorrin-6Y C5,15-methyltransferase (decarboxylating) [EC:2.1.1.132]"	K00595	9	8	0	0	0	0	1639	1639	1639
"cobM, cbiF; precorrin-4/cobalt-precorrin-4 C11-methyltransferase [EC:2.1.1.133 2.1.1.271]"	K05936	9	0	3	5	6.53023179838062e-05	7.2558131093118e-06	11917	1324.11111111111	349
"cobP, cobU; adenosylcobinamide kinase / adenosylcobinamide-phosphate guanylyltransferase [EC:2.7.1.156 2.7.7.62]"	K02231	9	0	2	5	7.85359694751708e-05	8.72621883057454e-06	11373	1263.66666666667	665
"cobQ, cbiP; adenosylcobyric acid synthase [EC:6.3.5.10]"	K02232	9	0	4	3	-6.14448882730616e-05	-6.82720980811796e-06	15119.5	1679.94444444444	667
"comA; ATP-binding cassette, subfamily C, bacterial, competence factor transporting protein [EC:3.4.22.-]"	K12292	9	0	3	5	2.3915257369565e-05	2.65725081884056e-06	12540.5	1393.38888888889	634
"comD; two-component system, LytTR family, sensor histidine kinase ComD [EC:2.7.13.3]"	K12294	9	0	2	5	9.72279741666285e-05	1.08031082407365e-05	11286	1254	411
"comE; two-component system, LytTR family, response regulator ComE"	K12295	9	0	4	4	0.000101635320047212	1.12928133385791e-05	12465.5	1385.05555555556	85
"cooS, acsA; anaerobic carbon-monoxide dehydrogenase catalytic subunit [EC:1.2.7.4]"	K00198	9	0	3	5	4.33172433158799e-05	4.81302703509777e-06	12442	1382.44444444444	545
"copA, ATP7; Cu+-exporting ATPase [EC:3.6.3.54]"	K17686	9	0	4	0	-0.000171134709561851	-1.90149677290945e-05	17623	1958.11111111111	1413.5
"copC, pcoC; copper resistance protein C"	K07156	9	0	4	3	-0.000109718212294372	-1.21909124771525e-05	14891.5	1654.61111111111	380
"COX15, ctaA; cytochrome c oxidase assembly protein subunit 15"	K02259	9	0	3	3	0.000118864068928797	1.32071187698663e-05	12759	1417.66666666667	186
"coxA, ctaD; cytochrome c oxidase subunit I [EC:1.9.3.1]"	K02274	9	0	1	3	4.24265389782641e-06	4.71405988647379e-07	12935	1437.22222222222	833.5
"coxB, ctaC; cytochrome c oxidase subunit II [EC:1.9.3.1]"	K02275	9	0	6	2	0.000101490794508849	1.12767549454277e-05	17244	1916	35
"cpaA, tadV; prepilin peptidase CpaA [EC:3.4.23.43]"	K02278	9	0	4	4	0.000181914378844399	2.02127087604888e-05	12697.5	1410.83333333333	158
"cpaE, tadZ; pilus assembly protein CpaE"	K02282	9	0	1	7	6.60221084153596e-05	7.33578982392884e-06	9656.5	1072.94444444444	92
"cpaF, tadA; pilus assembly protein CpaF"	K02283	9	0	2	4	3.46022441946434e-05	3.84469379940482e-06	12564	1396	485
"cpdA; 3',5'-cyclic-AMP phosphodiesterase [EC:3.1.4.53]"	K03651	9	0	5	3	6.37939435413777e-05	7.08821594904197e-06	15532	1725.77777777778	73
"cpdB; 2',3'-cyclic-nucleotide 2'-phosphodiesterase / 3'-nucleotidase [EC:3.1.4.16 3.1.3.6]"	K01119	9	0	0	2	6.43929983060417e-05	7.15477758956019e-06	12102	1344.66666666667	267
"cpoA; 1,2-diacylglycerol-3-alpha-glucose alpha-1,2-galactosyltransferase [EC:2.4.1.-]"	K13678	9	0	3	4	0.000177817822965338	1.97575358850376e-05	11634.5	1292.72222222222	142
"CPOX, hemF; coproporphyrinogen III oxidase [EC:1.3.3.3]"	K00228	9	0	2	4	0.000183087594560245	2.03430660622495e-05	10917.5	1213.05555555556	357
"cpxA; two-component system, OmpR family, sensor histidine kinase CpxA [EC:2.7.13.3]"	K07640	9	0	6	3	-0.000262837299083135	-2.92041443425706e-05	17453.5	1939.27777777778	208
"cpxR; two-component system, OmpR family, response regulator CpxR"	K07662	9	0	2	3	-1.27567458491454e-05	-1.4174162054606e-06	13629.5	1514.38888888889	939
"crcB, FEX; fluoride exporter"	K06199	9	0	5	1	-0.00038258412851367	-4.250934761263e-05	18705	2078.33333333333	1160
"creC; two-component system, OmpR family, sensor histidine kinase CreC [EC:2.7.13.3]"	K07641	9	0	1	8	0.0014740535609008	0.000163783728988978	4917	546.333333333333	11
"crp; CRP/FNR family transcriptional regulator, cyclic AMP receptor protein"	K10914	9	0	5	3	-0.000236279162613879	-2.6253240290431e-05	15986	1776.22222222222	206
"CS, gltA; citrate synthase [EC:2.3.3.1]"	K01647	9	0	3	5	0.00021775578550486	2.41950872783177e-05	10921.5	1213.5	7
"csd1, cas8c; CRISPR-associated protein Csd1"	K19117	9	0	1	4	6.03497707105864e-05	6.70553007895404e-06	11664.5	1296.05555555556	412
"csd2, cas7; CRISPR-associated protein Csd2"	K19118	9	0	4	3	0.000443378104612652	4.92642338458502e-05	13367.5	1485.27777777778	12
"csm1, cas10; CRISPR-associated protein Csm1"	K07016	9	0	0	3	7.8256574589342e-05	8.69517495437133e-06	11836	1315.11111111111	576
"cspA; cold shock protein (beta-ribbon, CspA family)"	K03704	9	0	2	4	9.85869247156269e-05	1.09541027461808e-05	12022.5	1335.83333333333	242.5
"cst1, cas8a; CRISPR-associated protein Cst1"	K19088	9	0	1	8	0.00109981566306643	0.000122201740340715	4676	519.555555555556	11
"cst2, cas7; CRISPR-associated protein Cst2"	K19075	9	0	3	5	0.000929791806922703	0.000103310200769189	10266	1140.66666666667	10
"cusA, silA; Cu(I)/Ag(I) efflux system membrane protein CusA/SilA"	K07787	9	0	4	2	6.03081165520684e-05	6.70090183911871e-06	14071.5	1563.5	259
"cusB, silB; membrane fusion protein, Cu(I)/Ag(I) efflux system"	K07798	9	0	2	5	0.0003175935257673	3.52881695297e-05	11563	1284.77777777778	66
"cvrA, nhaP2; cell volume regulation protein A"	K11105	9	0	4	4	0.000155720596984421	1.73022885538246e-05	12196.5	1355.16666666667	268
"cyaA; adenylate cyclase, class 1 [EC:4.6.1.1]"	K05851	9	0	4	4	2.66678246717729e-05	2.96309163019698e-06	14052	1561.33333333333	65
"CYC1, CYT1, petC; ubiquinol-cytochrome c reductase cytochrome c1 subunit"	K00413	9	0	3	6	0.00029350748622701	3.26119429141122e-05	9847	1094.11111111111	65
"cycB, ganO; arabinogalactan oligomer / maltooligosaccharide transport system substrate-binding protein"	K15770	9	0	1	3	8.87095475330755e-06	9.85661639256394e-07	13021	1446.77777777778	844
"cydC; ATP-binding cassette, subfamily C, bacterial CydC"	K16012	9	0	6	3	-1.95505651490148e-05	-2.1722850165572e-06	16804	1867.11111111111	145
"cydCD; ATP-binding cassette, subfamily C, bacterial CydCD"	K16014	9	0	5	3	-9.31833806673559e-05	-1.03537089630395e-05	15882.5	1764.72222222222	118
"cydD; ATP-binding cassette, subfamily C, bacterial CydD"	K16013	9	0	5	4	-2.96647037191332e-05	-3.2960781910148e-06	14557	1617.44444444444	357
"cynR; LysR family transcriptional regulator, cyn operon transcriptional activator"	K11921	9	0	3	6	9.06557319958748e-05	1.00728591106528e-05	9908	1100.88888888889	99
"cynT, can; carbonic anhydrase [EC:4.2.1.1]"	K01673	9	0	3	2	-4.4537641715821e-05	-4.94862685731345e-06	14463	1607	197
"cysB; LysR family transcriptional regulator, cys regulon transcriptional activator"	K13634	9	0	6	3	-0.000239127387332062	-2.65697097035624e-05	17403	1933.66666666667	125
"cysP, sbp; sulfate transport system substrate-binding protein"	K02048	9	0	1	6	0.000141107770667208	1.56786411852453e-05	9594	1066	182
"cysQ, MET22, BPNT1; 3'(2'), 5'-bisphosphate nucleotidase [EC:3.1.3.7]"	K01082	9	6	0	0	0	0	4758	1586	1530
"CYTB, petB; ubiquinol-cytochrome c reductase cytochrome b subunit"	K00412	9	0	6	3	-2.78485879348515e-05	-3.09428754831684e-06	15298.5	1699.83333333333	134.5
"czcD, zitB; cobalt-zinc-cadmium efflux system protein"	K16264	9	0	3	4	2.27912150818961e-05	2.53235723132179e-06	13564.5	1507.16666666667	494
"dacC, dacA, dacD; serine-type D-Ala-D-Ala carboxypeptidase (penicillin-binding protein 5/6) [EC:3.4.16.4]"	K07258	9	0	6	3	-4.88429633351369e-05	-5.42699592612632e-06	15204.5	1689.38888888889	529
