Taxon	feature	n	n_NA	n_neg	n_pos	imp_sum	imp_mean	imp_rank_sum	imp_rank_mean	imp_rank_min
"pksE; trans-AT polyketide synthase, acyltransferase and oxidoreductase domains"	K15329	9	8	0	0	0	0	1653	1653	1653
"pncB, NAPRT1; nicotinate phosphoribosyltransferase [EC:6.3.4.21]"	K00763	9	0	2	5	7.50709911780961e-05	8.34122124201068e-06	12291.5	1365.72222222222	324
"PPCDC, coaC; phosphopantothenoylcysteine decarboxylase [EC:4.1.1.36]"	K01598	9	0	1	4	0.00014883723780916	1.65374708676844e-05	11946	1327.33333333333	118
"PPCS, COAB; phosphopantothenate---cysteine ligase (ATP) [EC:6.3.2.51]"	K01922	9	0	0	2	2.40418118466899e-05	2.67131242740999e-06	13440.5	1493.38888888889	974
"ppdK; pyruvate, orthophosphate dikinase [EC:2.7.9.1]"	K01006	9	1	0	0	0	0	12852.5	1606.5625	1435.5
"PPIB, ppiB; peptidyl-prolyl cis-trans isomerase B (cyclophilin B) [EC:5.2.1.8]"	K03768	9	0	3	6	0.000298675355150523	3.31861505722803e-05	9856	1095.11111111111	254
"ppnK, NADK; NAD+ kinase [EC:2.7.1.23]"	K00858	9	0	1	5	9.87622981753418e-05	1.09735886861491e-05	11638.5	1293.16666666667	396
"PPOX, hemY; protoporphyrinogen/coproporphyrinogen III oxidase [EC:1.3.3.4 1.3.3.15]"	K00231	9	0	4	2	-0.000141017146955354	-1.56685718839283e-05	17356.5	1928.5	939
"pps, ppsA; pyruvate, water dikinase [EC:2.7.9.2]"	K01007	9	0	4	5	0.000284018276205962	3.15575862451069e-05	11449	1272.11111111111	138
"ppsR; [pyruvate, water dikinase]-phosphate phosphotransferase / [pyruvate, water dikinase] kinase [EC:2.7.4.28 2.7.11.33]"	K09773	9	0	2	0	-1.85106382978724e-05	-2.05673758865248e-06	15468	1718.66666666667	1435.5
"ppx-gppA; exopolyphosphatase / guanosine-5'-triphosphate,3'-diphosphate pyrophosphatase [EC:3.6.1.11 3.6.1.40]"	K01524	9	0	4	4	1.63403531731929e-05	1.81559479702143e-06	14236.5	1581.83333333333	390
"praC, xylH; 4-oxalocrotonate tautomerase [EC:5.3.2.6]"	K01821	9	0	4	5	4.00039427649353e-05	4.44488252943726e-06	13492.5	1499.16666666667	374
"prdX, proX; Ala-tRNA(Pro) deacylase [EC:3.1.1.-]"	K19055	9	0	1	6	5.05863088562153e-05	5.62070098402392e-06	10708.5	1189.83333333333	464
"PRDX2_4, ahpC; peroxiredoxin (alkyl hydroperoxide reductase subunit C) [EC:1.11.1.15]"	K03386	9	0	4	4	-0.000151394706889389	-1.68216340988209e-05	15300	1700	769
"prfA, MTRF1, MRF1; peptide chain release factor 1"	K02835	9	0	5	3	8.48282396525117e-05	9.42535996139019e-06	14524.5	1613.83333333333	165
"PRK, prkB; phosphoribulokinase [EC:2.7.1.19]"	K00855	9	0	3	5	-4.65198071637274e-05	-5.16886746263638e-06	14136	1570.66666666667	590
"PRPS, prsA; ribose-phosphate pyrophosphokinase [EC:2.7.6.1]"	K00948	9	0	1	3	6.2405207783359e-05	6.93391197592878e-06	12695.5	1410.61111111111	598
"psd, PISD; phosphatidylserine decarboxylase [EC:4.1.1.65]"	K01613	9	0	0	1	3.75e-05	4.16666666666667e-06	13539.5	1504.38888888889	471.5
"PTER, php; phosphotriesterase-related protein"	K07048	9	0	3	5	3.65960191322374e-05	4.06622434802638e-06	13241	1471.22222222222	472
"PTH1, pth, spoVC; peptidyl-tRNA hydrolase, PTH1 family [EC:3.1.1.29]"	K01056	9	0	4	5	0.000225315385304214	2.50350428115793e-05	12984	1442.66666666667	121
"PTH2; peptidyl-tRNA hydrolase, PTH2 family [EC:3.1.1.29]"	K04794	9	0	3	6	0.00165316007796941	0.000183684453107712	10335	1148.33333333333	4
"PTS-Aga-EIIA, agaF; PTS system, N-acetylgalactosamine-specific IIA component [EC:2.7.1.-]"	K02744	9	0	4	4	2.9907591165987e-06	3.32306568510967e-07	14356.5	1595.16666666667	769
"PTS-Aga-EIIB, agaV; PTS system, N-acetylgalactosamine-specific IIB component [EC:2.7.1.-]"	K02745	9	0	4	5	0.000257457647996137	2.86064053329041e-05	11675	1297.22222222222	119
"PTS-Aga-EIIC, agaW; PTS system, N-acetylgalactosamine-specific IIC component"	K02746	9	0	5	4	-5.74004588976787e-05	-6.37782876640874e-06	14859	1651	330
"PTS-Aga-EIID, agaE; PTS system, N-acetylgalactosamine-specific IID component"	K02747	9	0	7	2	-0.000522884600104206	-5.80982889004674e-05	19847	2205.22222222222	148
"PTS-Bgl-EIIA, bglF, bglP; PTS system, beta-glucoside-specific IIA component [EC:2.7.1.-]"	K02755	9	0	6	3	0.000118974859118007	1.32194287908896e-05	17016	1890.66666666667	70
"PTS-Bgl-EIIC, bglF, bglP; PTS system, beta-glucoside-specific IIC component"	K02757	9	0	4	5	4.04537689748567e-05	4.49486321942853e-06	13528	1503.11111111111	153
"PTS-Cel-EIIA, celC, chbA; PTS system, cellobiose-specific IIA component [EC:2.7.1.196 2.7.1.205]"	K02759	9	0	3	6	0.000129524060281783	1.43915622535315e-05	12018.5	1335.38888888889	155
"PTS-Cel-EIIB, celA, chbB; PTS system, cellobiose-specific IIB component [EC:2.7.1.196 2.7.1.205]"	K02760	9	0	1	8	0.000181604974575813	2.01783305084237e-05	8667.5	963.055555555556	560
"PTS-Cel-EIIC, celB, chbC; PTS system, cellobiose-specific IIC component"	K02761	9	0	5	4	0.000377432000370381	4.19368889300424e-05	13184	1464.88888888889	73
"PTS-EI.PTSI, ptsI; phosphotransferase system, enzyme I, PtsI [EC:2.7.3.9]"	K08483	9	0	3	2	-3.63672328204347e-05	-4.04080364671496e-06	15436	1715.11111111111	992
"PTS-Fru-EIIA, fruB; PTS system, fructose-specific IIA component [EC:2.7.1.202]"	K02768	9	0	2	7	0.000289909409539274	3.22121566154749e-05	9323	1035.88888888889	148
"PTS-Fru-EIIB, fruA; PTS system, fructose-specific IIB component [EC:2.7.1.202]"	K02769	9	0	6	3	-0.000423509860181812	-4.70566511313124e-05	18734	2081.55555555556	281
"PTS-Fru-EIIC, fruA; PTS system, fructose-specific IIC component"	K02770	9	0	2	5	7.451690009405e-05	8.27965556600556e-06	12394.5	1377.16666666667	467
"PTS-Gat-EIIA, gatA, sgcA; PTS system, galactitol-specific IIA component [EC:2.7.1.200]"	K02773	9	0	6	1	-7.48230235068488e-05	-8.31366927853875e-06	17308	1923.11111111111	524
"PTS-Gat-EIIB, gatB, sgcB; PTS system, galactitol-specific IIB component [EC:2.7.1.200]"	K02774	9	0	4	4	-5.07886479108215e-05	-5.64318310120239e-06	15137	1681.88888888889	732
"PTS-Gat-EIIC, gatC, sgcC; PTS system, galactitol-specific IIC component"	K02775	9	0	5	4	5.558634251512e-05	6.17626027945777e-06	14020	1557.77777777778	156
"PTS-Gfr-EIIA, gfrA; PTS system, fructoselysine/glucoselysine-specific IIA component [EC:2.7.1.-]"	K19506	9	0	5	4	0.000114177074663259	1.2686341629251e-05	13244	1471.55555555556	55
"PTS-Gfr-EIIB, gfrB; PTS system, fructoselysine/glucoselysine-specific IIB component [EC:2.7.1.-]"	K19507	9	0	6	3	-5.0486214454063e-05	-5.60957938378478e-06	15712.5	1745.83333333333	298
"PTS-Gfr-EIIC, gfrC; PTS system, fructoselysine/glucoselysine-specific IIC component"	K19508	9	0	5	3	7.88678110756827e-05	8.7630901195203e-06	14690	1632.22222222222	116
"PTS-Glc-EIIA, crr; PTS system, sugar-specific IIA component [EC:2.7.1.-]"	K02777	9	0	4	3	-0.000103414853490347	-1.14905392767052e-05	16436	1826.22222222222	664
"PTS-Glc-EIIC, ptsG; PTS system, glucose-specific IIC component"	K02779	9	0	3	4	5.17786050633178e-05	5.75317834036864e-06	12903	1433.66666666667	399
"PTS-Glv-EIIC, glvC, malP, aglA; PTS system, alpha-glucoside-specific IIC component"	K02750	9	0	4	3	-2.38476328680103e-05	-2.64973698533447e-06	15091	1676.77777777778	561
"PTS-Gut-EIIA, srlB; PTS system, glucitol/sorbitol-specific IIA component [EC:2.7.1.198]"	K02781	9	0	5	4	8.03440717372029e-06	8.92711908191144e-07	14803	1644.77777777778	300
"PTS-Gut-EIIC, srlA; PTS system, glucitol/sorbitol-specific IIC component"	K02783	9	0	2	5	0.000204580889096043	2.27312098995603e-05	10981	1220.11111111111	225
"PTS-HPR.FRUB, fruB, fpr; phosphocarrier protein FPr"	K11183	9	0	0	0	0	0	14503.5	1611.5	1435.5
"PTS-HPR.PTSH, ptsH; phosphocarrier protein HPr"	K02784	9	0	5	3	-4.30611388141102e-05	-4.78457097934558e-06	15518.5	1724.27777777778	361
"PTS-Lac-EIIA, lacF; PTS system, lactose-specific IIA component [EC:2.7.1.207]"	K02786	9	0	4	1	-6.04939504939504e-05	-6.72155005488338e-06	16615.5	1846.16666666667	1033.5
"PTS-Lac-EIIC, lacE; PTS system, lactose-specific IIC component"	K02788	9	0	5	4	-3.95766629763976e-05	-4.39740699737751e-06	15283	1698.11111111111	555
"PTS-Man-EIIA, manX; PTS system, mannose-specific IIA component [EC:2.7.1.191]"	K02793	9	0	6	2	-0.000119389947126526	-1.32655496807251e-05	17718	1968.66666666667	532
"PTS-Man-EIIB, manX; PTS system, mannose-specific IIB component [EC:2.7.1.191]"	K02794	9	0	8	1	-0.000238847745895406	-2.65386384328229e-05	20303	2255.88888888889	756
"PTS-Man-EIIC, manY; PTS system, mannose-specific IIC component"	K02795	9	0	4	3	0.000260201615202079	2.89112905780088e-05	14034.5	1559.38888888889	34
"PTS-Man-EIID, manZ; PTS system, mannose-specific IID component"	K02796	9	0	2	6	0.000446730858602135	4.96367620669039e-05	10064	1118.22222222222	35
"PTS-Mtl-EIIC, mtlA, cmtA; PTS system, mannitol-specific IIC component"	K02800	9	0	3	5	8.52331898976604e-05	9.47035443307338e-06	12221	1357.88888888889	692
"PTS-Nag-EIIB, nagE; PTS system, N-acetylglucosamine-specific IIB component [EC:2.7.1.193]"	K02803	9	4	0	0	0	0	7934	1586.8	1435.5
"PTS-Nag-EIIC, nagE; PTS system, N-acetylglucosamine-specific IIC component"	K02804	9	0	3	6	0.000543500662916291	6.03889625462546e-05	11366	1262.88888888889	19
"PTS-Ntr-EIIA, ptsN; PTS system, nitrogen regulatory IIA component [EC:2.7.1.-]"	K02806	9	1	1	0	-2.75862068965517e-05	-3.44827586206897e-06	13841	1730.125	1435.5
"PTS-Scr-EIIC, scrA, sacP, sacX, ptsS; PTS system, sucrose-specific IIC component"	K02810	9	0	0	2	3.93246187363834e-05	4.36940208182038e-06	13037	1448.55555555556	917
"PTS-Tre-EIIC, treB; PTS system, trehalose-specific IIC component"	K02819	9	0	2	4	8.12057826859692e-05	9.02286474288546e-06	13389.5	1487.72222222222	214
"PTS-Ula-EIIA, ulaC, sgaA; PTS system, ascorbate-specific IIA component [EC:2.7.1.194]"	K02821	9	5	0	0	0	0	6486.5	1621.625	1435.5
"PTS-Ula-EIIB, ulaB, sgaB; PTS system, ascorbate-specific IIB component [EC:2.7.1.194]"	K02822	9	0	3	3	-7.58590487351544e-05	-8.42878319279494e-06	15052	1672.44444444444	644
"PTS-Ula-EIIC, ulaA, sgaT; PTS system, ascorbate-specific IIC component"	K03475	9	0	1	2	2.1709199215074e-05	2.41213324611933e-06	13759.5	1528.83333333333	860
"punA, PNP; purine-nucleoside phosphorylase [EC:2.4.2.1]"	K03783	9	0	3	6	0.000635343845081864	7.05937605646516e-05	9829.5	1092.16666666667	13
"purA, ADSS; adenylosuccinate synthase [EC:6.3.4.4]"	K01939	9	5	0	0	0	0	6509	1627.25	1458
"purB, ADSL; adenylosuccinate lyase [EC:4.3.2.2]"	K01756	9	3	0	0	0	0	9959	1659.83333333333	1518.5
"purF, PPAT; amidophosphoribosyltransferase [EC:2.4.2.14]"	K00764	9	0	1	8	0.000879614253346431	9.77349170384924e-05	5351	594.555555555556	25
"purL, PFAS; phosphoribosylformylglycinamidine synthase [EC:6.3.5.3]"	K01952	9	0	4	5	6.87476097194816e-05	7.63862330216462e-06	13442	1493.55555555556	222
"purR; LacI family transcriptional regulator, purine nucleotide synthesis repressor"	K03604	9	0	3	6	-8.38765792758225e-06	-9.31961991953583e-07	13023.5	1447.05555555556	648
"putA; RHH-type transcriptional regulator, proline utilization regulon repressor / proline dehydrogenase / delta 1-pyrroline-5-carboxylate dehydrogenase [EC:1.5.5.2 1.2.1.88]"	K13821	9	0	2	6	0.000341588614393606	3.79542904881784e-05	9881.5	1097.94444444444	43
"puuB, ordL; gamma-glutamylputrescine oxidase [EC:1.4.3.-]"	K09471	9	3	0	0	0	0	9874	1645.66666666667	1435.5
"PYG, glgP; glycogen phosphorylase [EC:2.4.1.1]"	K00688	9	0	2	5	-4.04799623377272e-05	-4.4977735930808e-06	12903	1433.66666666667	542
"pyrB, PYR2; aspartate carbamoyltransferase catalytic subunit [EC:2.1.3.2]"	K00609	9	0	6	3	-6.06146618217215e-05	-6.73496242463573e-06	16740	1860	238
"pyrG, CTPS; CTP synthase [EC:6.3.4.2]"	K01937	9	9	0	0	0	NA	0	NA	Inf
"pyrP, uraA; uracil permease"	K02824	9	0	0	0	0	0	14503.5	1611.5	1435.5
"QARS, glnS; glutaminyl-tRNA synthetase [EC:6.1.1.18]"	K01886	9	0	2	7	0.000468225652336662	5.20250724818514e-05	9069	1007.66666666667	32
"qor, CRYZ; NADPH2:quinone reductase [EC:1.6.5.5]"	K00344	9	0	6	2	-7.10752522253921e-05	-7.89725024726579e-06	16923.5	1880.38888888889	786.5
"qseB; two-component system, OmpR family, response regulator QseB"	K07666	9	0	4	5	0.000185174080938146	2.05748978820162e-05	13096	1455.11111111111	79
"qseC; two-component system, OmpR family, sensor histidine kinase QseC [EC:2.7.13.3]"	K07645	9	0	4	5	0.000227715963801718	2.53017737557464e-05	11428	1269.77777777778	142
"queD, ptpS, PTS; 6-pyruvoyltetrahydropterin/6-carboxytetrahydropterin synthase [EC:4.2.3.12 4.1.2.50]"	K01737	9	0	4	5	5.05253722893758e-05	5.61393025437509e-06	13365.5	1485.05555555556	204
"RARS, argS; arginyl-tRNA synthetase [EC:6.1.1.19]"	K01887	9	0	5	3	1.81911994239901e-05	2.02124438044335e-06	15017.5	1668.61111111111	432.5
"rbsK, RBKS; ribokinase [EC:2.7.1.15]"	K00852	9	8	0	0	0	0	1747	1747	1747
"regX3; two-component system, OmpR family, response regulator RegX3"	K07776	9	0	5	4	-6.3206877935431e-05	-7.02298643727011e-06	15754	1750.44444444444	396
"relE, stbE; mRNA interferase RelE/StbE"	K06218	9	0	4	3	-0.000219890749429554	-2.44323054921726e-05	16876.5	1875.16666666667	642
"resB, ccs1; cytochrome c biogenesis protein"	K07399	9	8	0	0	0	0	1747	1747	1747
"RETSAT; all-trans-retinol 13,14-reductase [EC:1.3.99.23]"	K09516	9	0	6	3	-0.000101621441862125	-1.12912713180139e-05	16916	1879.55555555556	34
"rfbC, rmlC; dTDP-4-dehydrorhamnose 3,5-epimerase [EC:5.1.3.13]"	K01790	9	0	6	3	-1.69685860966712e-05	-1.88539845518568e-06	15811.5	1756.83333333333	518
"rfbD, rmlD; dTDP-4-dehydrorhamnose reductase [EC:1.1.1.133]"	K00067	9	0	1	0	-1.29032258064516e-05	-1.43369175627241e-06	15052	1672.44444444444	1435.5
"rfbG; CDP-glucose 4,6-dehydratase [EC:4.2.1.45]"	K01709	9	0	4	4	0.000138647613147151	1.54052903496834e-05	13188	1465.33333333333	117
"ribA, RIB1; GTP cyclohydrolase II [EC:3.5.4.25]"	K01497	9	8	0	0	0	0	1747	1747	1747
"ribB, RIB3; 3,4-dihydroxy 2-butanone 4-phosphate synthase [EC:4.1.99.12]"	K02858	9	0	4	5	0.000190363900255218	2.1151544472802e-05	12468	1385.33333333333	89
"ribBA; 3,4-dihydroxy 2-butanone 4-phosphate synthase / GTP cyclohydrolase II [EC:4.1.99.12 3.5.4.25]"	K14652	9	0	7	1	-0.000172503914986735	-1.91671016651928e-05	18965.5	2107.27777777778	714
"ribE, RIB5; riboflavin synthase [EC:2.5.1.9]"	K00793	9	0	0	0	0	0	14503.5	1611.5	1435.5
"ribH, RIB4; 6,7-dimethyl-8-ribityllumazine synthase [EC:2.5.1.78]"	K00794	9	0	2	3	-3.01469034891452e-05	-3.34965594323835e-06	14384.5	1598.27777777778	601
"ridA, tdcF, RIDA; 2-iminobutanoate/2-iminopropanoate deaminase [EC:3.5.99.10]"	K09022	9	0	5	4	-0.000129867935159868	-1.44297705733186e-05	16311	1812.33333333333	193
"rlmE, rrmJ, ftsJ; 23S rRNA (uridine2552-2'-O)-methyltransferase [EC:2.1.1.166]"	K02427	9	1	0	0	0	0	12763.5	1595.4375	1435.5
"rlmL, rlmK; 23S rRNA (guanine2445-N2)-methyltransferase / 23S rRNA (guanine2069-N7)-methyltransferase [EC:2.1.1.173 2.1.1.264]"	K12297	9	0	2	7	0.000268530714932729	2.98367461036366e-05	8959	995.444444444444	197
"rnc, DROSHA, RNT1; ribonuclease III [EC:3.1.26.3]"	K03685	9	0	4	4	-3.95483128301643e-05	-4.39425698112937e-06	14542	1615.77777777778	367
"rng, cafA; ribonuclease G [EC:3.1.26.-]"	K08301	9	0	1	0	-1.08108108108108e-05	-1.2012012012012e-06	15014	1668.22222222222	1458
"rnhA, RNASEH1; ribonuclease HI [EC:3.1.26.4]"	K03469	9	0	7	2	-0.000335754522099304	-3.73060580110338e-05	18472	2052.44444444444	184
"rnr, vacB; ribonuclease R [EC:3.1.-.-]"	K12573	9	5	0	0	0	0	6658.5	1664.625	1518.5
"rocD, OAT; ornithine--oxo-acid transaminase [EC:2.6.1.13]"	K00819	9	0	7	2	-0.000575330776539163	-6.39256418376848e-05	21331	2370.11111111111	1004
"rodA, mrdB; rod shape determining protein RodA"	K05837	9	0	6	3	0.000458485706182609	5.09428562425121e-05	15075	1675	22
"RP-L1, MRPL1, rplA; large subunit ribosomal protein L1"	K02863	9	0	2	3	-8.54764808234459e-06	-9.49738675816066e-07	14278.5	1586.5	517
"RP-L10, MRPL10, rplJ; large subunit ribosomal protein L10"	K02864	9	0	2	1	-1.50834846867678e-05	-1.6759427429742e-06	15161.5	1684.61111111111	1222.5
"RP-L11, MRPL11, rplK; large subunit ribosomal protein L11"	K02867	9	0	3	0	-3.36618214666995e-05	-3.74020238518884e-06	16191.5	1799.05555555556	1435.5
"RP-L13, MRPL13, rplM; large subunit ribosomal protein L13"	K02871	9	2	0	1	1.05263157894737e-05	1.50375939849625e-06	10912	1558.85714285714	1013.5
"RP-L14, MRPL14, rplN; large subunit ribosomal protein L14"	K02874	9	0	2	1	-3.12017539430054e-05	-3.46686154922282e-06	15402	1711.33333333333	1301
"RP-L15, MRPL15, rplO; large subunit ribosomal protein L15"	K02876	9	0	4	5	0.00051817718274878	5.75752425276422e-05	11823	1313.66666666667	49
"RP-L16, MRPL16, rplP; large subunit ribosomal protein L16"	K02878	9	8	0	0	0	0	1740	1740	1740
"RP-L17, MRPL17, rplQ; large subunit ribosomal protein L17"	K02879	9	0	4	5	0.000376613111027109	4.18459012252344e-05	11992	1332.44444444444	54
"RP-L18, MRPL18, rplR; large subunit ribosomal protein L18"	K02881	9	6	0	0	0	0	4911.5	1637.16666666667	1518.5
"RP-L19, MRPL19, rplS; large subunit ribosomal protein L19"	K02884	9	0	0	0	0	0	14503.5	1611.5	1435.5
"RP-L20, MRPL20, rplT; large subunit ribosomal protein L20"	K02887	9	2	0	1	1.72161172161172e-05	2.45944531658817e-06	10803	1543.28571428571	1058
"RP-L21, MRPL21, rplU; large subunit ribosomal protein L21"	K02888	9	0	5	4	0.000228651039950274	2.5405671105586e-05	14125	1569.44444444444	109
"RP-L23, MRPL23, rplW; large subunit ribosomal protein L23"	K02892	9	5	0	0	0	0	6658.5	1664.625	1518.5
"RP-L25, rplY; large subunit ribosomal protein L25"	K02897	9	0	8	1	-0.000434532555351468	-4.82813950390521e-05	21444	2382.66666666667	1206
"RP-L27, MRPL27, rpmA; large subunit ribosomal protein L27"	K02899	9	0	3	6	0.000110119381039998	1.2235486782222e-05	11703	1300.33333333333	333
"RP-L28, MRPL28, rpmB; large subunit ribosomal protein L28"	K02902	9	8	0	0	0	0	1719	1719	1719
"RP-L3, MRPL3, rplC; large subunit ribosomal protein L3"	K02906	9	8	0	0	0	0	1653	1653	1653
"RP-L30, MRPL30, rpmD; large subunit ribosomal protein L30"	K02907	9	0	3	6	0.000579841527220977	6.44268363578863e-05	9325.5	1036.16666666667	85
"RP-L31, rpmE; large subunit ribosomal protein L31"	K02909	9	0	3	4	3.11090430990196e-05	3.45656034433551e-06	14254	1583.77777777778	298
"RP-L32, MRPL32, rpmF; large subunit ribosomal protein L32"	K02911	9	8	0	0	0	0	1653	1653	1653
"RP-L33, MRPL33, rpmG; large subunit ribosomal protein L33"	K02913	9	0	6	3	0.000182200057466173	2.02444508295748e-05	16989	1887.66666666667	38
"RP-L35, MRPL35, rpmI; large subunit ribosomal protein L35"	K02916	9	0	2	7	0.00181881167235566	0.000202090185817295	4781	531.222222222222	20
"RP-L4, MRPL4, rplD; large subunit ribosomal protein L4"	K02926	9	3	0	0	0	0	9959	1659.83333333333	1518.5
"RP-L5, MRPL5, rplE; large subunit ribosomal protein L5"	K02931	9	4	0	0	0	0	7977	1595.4	1435.5
"RP-L6, MRPL6, rplF; large subunit ribosomal protein L6"	K02933	9	8	0	0	0	0	1653	1653	1653
"RP-L7, MRPL12, rplL; large subunit ribosomal protein L7/L12"	K02935	9	1	0	1	2.62969588550984e-05	3.2871198568873e-06	12221	1527.625	872
"RP-L9, MRPL9, rplI; large subunit ribosomal protein L9"	K02939	9	9	0	0	0	NA	0	NA	Inf
"RP-S1, rpsA; small subunit ribosomal protein S1"	K02945	9	0	0	1	2.5e-05	2.77777777777778e-06	13665.5	1518.38888888889	813
"RP-S10, MRPS10, rpsJ; small subunit ribosomal protein S10"	K02946	9	0	0	2	6.4102564102564e-05	7.12250712250712e-06	12580	1397.77777777778	586
"RP-S11, MRPS11, rpsK; small subunit ribosomal protein S11"	K02948	9	0	2	2	-1.86067988858686e-05	-2.06742209842985e-06	14807.5	1645.27777777778	684.5
"RP-S12, MRPS12, rpsL; small subunit ribosomal protein S12"	K02950	9	0	0	9	0.00257458157440462	0.000286064619378291	2416	268.444444444444	6
"RP-S13, rpsM; small subunit ribosomal protein S13"	K02952	9	0	4	4	7.43966384807097e-05	8.2662931645233e-06	13062	1451.33333333333	482
"RP-S14, MRPS14, rpsN; small subunit ribosomal protein S14"	K02954	9	6	0	0	0	0	4922.5	1640.83333333333	1435.5
"RP-S15, MRPS15, rpsO; small subunit ribosomal protein S15"	K02956	9	0	1	2	6.19427267627385e-05	6.88252519585983e-06	12970	1441.11111111111	666
"RP-S16, MRPS16, rpsP; small subunit ribosomal protein S16"	K02959	9	0	2	7	0.000830732331244496	9.23035923604995e-05	7302	811.333333333333	72
"RP-S18, MRPS18, rpsR; small subunit ribosomal protein S18"	K02963	9	0	2	4	2.63117165244825e-05	2.92352405827583e-06	13342.5	1482.5	924
"RP-S19, rpsS; small subunit ribosomal protein S19"	K02965	9	0	0	2	2.03634085213032e-05	2.26260094681147e-06	13491	1499	907.5
"RP-S2, MRPS2, rpsB; small subunit ribosomal protein S2"	K02967	9	1	0	1	1.25e-05	1.5625e-06	12433.5	1554.1875	1018.5
"RP-S20, rpsT; small subunit ribosomal protein S20"	K02968	9	0	1	5	0.000149485983816172	1.66095537573524e-05	11081.5	1231.27777777778	243
"RP-S21, MRPS21, rpsU; small subunit ribosomal protein S21"	K02970	9	0	0	3	3.1978021978022e-05	3.55311355311356e-06	12983.5	1442.61111111111	954.5
"RP-S3, rpsC; small subunit ribosomal protein S3"	K02982	9	0	3	6	0.00122048181039341	0.000135609090043713	9731	1081.22222222222	25
"RP-S6, MRPS6, rpsF; small subunit ribosomal protein S6"	K02990	9	0	5	3	-8.27559401764931e-05	-9.19510446405479e-06	16544	1838.22222222222	914
"RP-S7, MRPS7, rpsG; small subunit ribosomal protein S7"	K02992	9	0	0	0	0	0	14503.5	1611.5	1435.5
"RP-S8, rpsH; small subunit ribosomal protein S8"	K02994	9	7	0	0	0	0	3393	1696.5	1653
"RP-S9, MRPS9, rpsI; small subunit ribosomal protein S9"	K02996	9	5	0	0	0	0	6630.5	1657.625	1518.5
"rpe, RPE; ribulose-phosphate 3-epimerase [EC:5.1.3.1]"	K01783	9	0	3	1	-3.37867317573274e-05	-3.75408130636971e-06	15609	1734.33333333333	595
"rpoE; RNA polymerase sigma-70 factor, ECF subfamily"	K03088	9	0	2	3	4.44912741718406e-05	4.94347490798229e-06	13466.5	1496.27777777778	644
"rraA, menG; regulator of ribonuclease activity A"	K02553	9	0	3	4	0.000158081877201782	1.75646530224203e-05	12392.5	1376.94444444444	153
"rsgA, engC; ribosome biogenesis GTPase / thiamine phosphate phosphatase [EC:3.6.1.- 3.1.3.100]"	K06949	9	0	3	6	0.00012326346865237	1.36959409613744e-05	11029.5	1225.5	257
"rsmB, sun; 16S rRNA (cytosine967-C5)-methyltransferase [EC:2.1.1.176]"	K03500	9	0	6	2	-0.00010018907923572	-1.113211991508e-05	17485.5	1942.83333333333	312
"RTCB, rtcB; tRNA-splicing ligase RtcB (3'-phosphate/5'-hydroxy nucleic acid ligase) [EC:6.5.1.8]"	K14415	9	0	3	6	0.000854044425445883	9.48938250495425e-05	10415	1157.22222222222	26
"saeR; two-component system, OmpR family, response regulator SaeR"	K10682	9	0	1	2	3.04954304954306e-05	3.38838116615895e-06	13489.5	1498.83333333333	764
"saeS; two-component system, OmpR family, sensor histidine kinase SaeS [EC:2.7.13.3]"	K10681	9	0	2	6	0.000297498271222453	3.30553634691614e-05	11211.5	1245.72222222222	83
"salK; two-component system, NarL family, secretion system sensor histidine kinase SalK"	K14988	9	0	2	6	0.000516740257897703	5.74155842108559e-05	9096	1010.66666666667	58
"salR; two-component system, NarL family, secretion system response regulator SalR"	K14989	9	0	4	5	0.000108377782388795	1.20419758209772e-05	13092	1454.66666666667	86
"SAM50, TOB55, bamA; outer membrane protein insertion porin family"	K07277	9	0	4	3	-7.90127630150412e-05	-8.77919589056013e-06	15994.5	1777.16666666667	868.5
"SARS, serS; seryl-tRNA synthetase [EC:6.1.1.11]"	K01875	9	0	3	3	0.000240752596926107	2.67502885473452e-05	13607	1511.88888888889	73
"sat, met3; sulfate adenylyltransferase [EC:2.7.7.4]"	K00958	9	0	1	1	-8.88888888888894e-07	-9.8765432098766e-08	14526.5	1614.05555555556	1309.5
"sbcB, exoI; exodeoxyribonuclease I [EC:3.1.11.1]"	K01141	9	0	5	4	-0.000123384510723592	-1.37093900803992e-05	14924	1658.22222222222	329
"sbcC, rad50; DNA repair protein SbcC/Rad50"	K03546	9	0	5	4	-0.000124867913343535	-1.38742125937261e-05	15408.5	1712.05555555556	242
"sbcD, mre11; DNA repair protein SbcD/Mre11"	K03547	9	0	4	5	0.000106122080049309	1.1791342227701e-05	13306	1478.44444444444	197
"sbmA, bacA; peptide/bleomycin uptake transporter"	K17938	9	0	2	4	0.000116389491371796	1.29321657079773e-05	11888	1320.88888888889	279
"scrR; LacI family transcriptional regulator, sucrose operon repressor"	K03484	9	0	1	7	0.000365696476878555	4.0632941875395e-05	9125.5	1013.94444444444	68
"sdhA, frdA; succinate dehydrogenase / fumarate reductase, flavoprotein subunit [EC:1.3.5.1 1.3.5.4]"	K00239	9	0	0	0	0	0	14503.5	1611.5	1435.5
"sdhB, frdB; succinate dehydrogenase / fumarate reductase, iron-sulfur subunit [EC:1.3.5.1 1.3.5.4]"	K00240	9	0	3	4	-2.71180417320079e-05	-3.01311574800087e-06	14435	1603.88888888889	792
"sdhC, frdC; succinate dehydrogenase / fumarate reductase, cytochrome b subunit"	K00241	9	0	2	3	-2.87754828282551e-05	-3.19727586980613e-06	14592.5	1621.38888888889	915.5
"sdhD, frdD; succinate dehydrogenase / fumarate reductase, membrane anchor subunit"	K00242	9	0	5	4	-5.32208264759342e-05	-5.91342516399269e-06	14986	1665.11111111111	243
"SEC11, sipW; signal peptidase I [EC:3.4.21.89]"	K13280	9	0	5	4	-6.6899294821758e-05	-7.43325498019533e-06	15932.5	1770.27777777778	263
"selB, EEFSEC; selenocysteine-specific elongation factor"	K03833	9	0	4	4	0.000196787469377095	2.18652743752328e-05	12566.5	1396.27777777778	196
"selD, SEPHS; selenide, water dikinase [EC:2.7.9.3]"	K01008	9	0	4	5	6.49305569458963e-05	7.21450632732181e-06	12832.5	1425.83333333333	221
"senX3; two-component system, OmpR family, sensor histidine kinase SenX3 [EC:2.7.13.3]"	K07768	9	0	2	5	0.000252451719196699	2.80501910218554e-05	10299	1144.33333333333	212
"serA, PHGDH; D-3-phosphoglycerate dehydrogenase / 2-oxoglutarate reductase [EC:1.1.1.95 1.1.1.399]"	K00058	9	0	2	5	0.000238909104221486	2.65454560246095e-05	11369	1263.22222222222	138
"serB, PSPH; phosphoserine phosphatase [EC:3.1.3.3]"	K01079	9	0	1	1	3.64444444444444e-05	4.04938271604938e-06	13745	1527.22222222222	588
"serC, PSAT1; phosphoserine aminotransferase [EC:2.6.1.52]"	K00831	9	0	0	1	6.25e-05	6.94444444444444e-06	13229.5	1469.94444444444	473
"SLC10A7, P7; solute carrier family 10 (sodium/bile acid cotransporter), member 7"	K14347	9	3	0	0	0	0	9526	1587.66666666667	1435.5
"SLC13A2_3_5; solute carrier family 13 (sodium-dependent dicarboxylate transporter), member 2/3/5"	K14445	9	0	1	3	3.58405051278763e-05	3.98227834754182e-06	13116.5	1457.38888888889	813
"slmA, ttk; TetR/AcrR family transcriptional regulator"	K05501	9	0	5	4	-0.000203951057279542	-2.26612285866158e-05	16345	1816.11111111111	388
"smvA, qacA, lfrA; MFS transporter, DHA2 family, multidrug resistance protein"	K08167	9	0	2	6	8.35465599362963e-05	9.28295110403293e-06	12044.5	1338.27777777778	324
